,Tweets,cleanedTweets
0,"If we hold current level on #BTC until today's closure I expect something like this for the next two months.

#bitcoin #crypto https://t.co/W3s6ED5wqm",If we hold current level on BTC until today's closure I expect something like this for the next two months.  bitcoin crypto 
1,"When I see all his losses in crypto, I strengthen my position in #XRP!
The only one who has no TECHNICAL problem until today.
We will soon see people stop their crypto projects because it is no longer worth anything...

#BTC #ETH #XRP #Elrond #CRO #USDT #LUNA","When I see all his losses in crypto, I strengthen my position in XRP! The only one who has no TECHNICAL problem until today. We will soon see people stop their crypto projects because it is no longer worth anything...  BTC ETH XRP Elrond CRO USDT LUNA"
2,Hadn't checked on my crypto portfolio in a while until today... getting ready for this ride 😮‍💨 https://t.co/ppcOXqDCMD,Hadn't checked on my crypto portfolio in a while until today... getting ready for this ride 😮‍💨 
3,#tether has moved well below the 100 line before (2017) but it’s been very stable in 2022. until today. if tether breaks you can kiss 90% of crypto goodbye. https://t.co/73FixBUnNG,tether has moved well below the 100 line before (2017) but it’s been very stable in 2022. until today. if tether breaks you can kiss 90% of crypto goodbye. 
4,"@DowneastCapital Client market sentiment is to find any crypto shitcoin that collapsed and act like it was a big deal back in the day. 
I’d heard 100x more about CumRocket than Luna until today.", Client market sentiment is to find any crypto shitcoin that collapsed and act like it was a big deal back in the day.  I’d heard 100x more about CumRocket than Luna until today.
5,"@SirajMansour @CmidasFx @Timeless_Crypto @stablekwon Pls keep in mind, if ya didn't sell ya didn't ""lose"" anything yet... Hopefully this msg is more along the lines of whatcha need right now. I was never a LUNAtic, until today. 😎","    Pls keep in mind, if ya didn't sell ya didn't ""lose"" anything yet... Hopefully this msg is more along the lines of whatcha need right now. I was never a LUNAtic, until today. 😎"
6,"@Crypto_MM_ that daily eth chart was looking so good until today. bullish reversal right on the 800 and not breaking the low, then we get a bearish VCR. Good thing I'm not married to the coin..."," that daily eth chart was looking so good until today. bullish reversal right on the 800 and not breaking the low, then we get a bearish VCR. Good thing I'm not married to the coin..."
7,Didn’t see the CRY in CRYpto until today. #btc #crypto #Coinbase,Didn’t see the CRY in CRYpto until today. btc crypto Coinbase
8,"@baidakova LUNA also had AVAX in their treasury. Maybe they sold, maybe they still do, I’m not sure. In any case, AVAX is also dumping hard, but didn’t start decoupling from crypto overall until today. I’m going with UST/LUNA causing the dump."," LUNA also had AVAX in their treasury. Maybe they sold, maybe they still do, I’m not sure. In any case, AVAX is also dumping hard, but didn’t start decoupling from crypto overall until today. I’m going with UST/LUNA causing the dump."
9,@Crypto_Chase I was 100 percent cash until today. I bought 20 percent of my portfolio today and I regret it, I was 100 percent cash until today. I bought 20 percent of my portfolio today and I regret it
10,@louie_crypto I have never held any Luna until today.... but threw a bit in at 13:00 today and cashed out at 15:30. Best trade of the year 👌, I have never held any Luna until today.... but threw a bit in at 13:00 today and cashed out at 15:30. Best trade of the year 👌
11,So many things happen on the Crypto Wild West until today. https://t.co/IGHZOm5ilD,So many things happen on the Crypto Wild West until today. 
12,"Up until today, been surprised at Crypto's resilience. Yes, market cap of aggregate space had halved since early 21, but retreat was quite orderly unlike all the trailer trash stocks. But today is the 1st day looks like retreat is turning into a rout! 

https://t.co/0fQOgsVxHr","Up until today, been surprised at Crypto's resilience. Yes, market cap of aggregate space had halved since early 21, but retreat was quite orderly unlike all the trailer trash stocks. But today is the 1st day looks like retreat is turning into a rout!   "
13,"If ur still holding ur crypto bag before today thinking it was bullish you may want to change who follow: 

Everyone still pumping crypto until today deserves to be unfollowed

Yes, #UST WAS LITERALLY sold in a trade for a penny, down from $1","If ur still holding ur crypto bag before today thinking it was bullish you may want to change who follow:   Everyone still pumping crypto until today deserves to be unfollowed  Yes, UST WAS LITERALLY sold in a trade for a penny, down from $1"
14,"@larry0x Respect to @stablekwon for staying strong , I wasn’t even a Luna holder until today. I’m happy to do my part for the crypto space!"," Respect to  for staying strong , I wasn’t even a Luna holder until today. I’m happy to do my part for the crypto space!"
15,"In my how many years in Crypto, never heard or seen a stable coin going down before until today, wonders shall never end lol -.","In my how many years in Crypto, never heard or seen a stable coin going down before until today, wonders shall never end lol -."
16,Early December 21 I bought this #lazyhat / best decision of my #Crypto n #nft life / never looked back ever since / Ty to all the ppl who have supported me until today ♥️♥️♥️🙏🙏🙏 https://t.co/OBFbAw0JcW,Early December 21 I bought this lazyhat / best decision of my Crypto n nft life / never looked back ever since / Ty to all the ppl who have supported me until today ♥️♥️♥️🙏🙏🙏 
17,"i've never been so passionate about crypto and blockchain technology until today, when the market has been at its lowest its been in a long time","i've never been so passionate about crypto and blockchain technology until today, when the market has been at its lowest its been in a long time"
18,@JRossNicoll I never bought any crypto until today, I never bought any crypto until today
19,"What if crypto is just so incredibly wound up on itself (p o n z i) that the value being extracted over the next few years is simply too overwhelming for liquidity and we get a true, nasty bear market. Up until today I hadn't really considered it seriously but now I'm concerned.","What if crypto is just so incredibly wound up on itself (p o n z i) that the value being extracted over the next few years is simply too overwhelming for liquidity and we get a true, nasty bear market. Up until today I hadn't really considered it seriously but now I'm concerned."
20,"@420Whoo No i really dont have it, i even thought the $Bam is a crypto not until today a minutes ago checking the link on relayx😆😂"," No i really dont have it, i even thought the $Bam is a crypto not until today a minutes ago checking the link on relayx😆😂"
21,"From Jan 2020 until today, my twitter feed (including on my alt) has been more accurate about everything than TradMedia.

So I look for discrepancies btw my feed and media views.

OFC one major discrepancy is crypto/NFTs.   The other one is long covid unfortunately.","From Jan 2020 until today, my twitter feed (including on my alt) has been more accurate about everything than TradMedia.  So I look for discrepancies btw my feed and media views.  OFC one major discrepancy is crypto/NFTs.   The other one is long covid unfortunately."
22,"@AshDoesCrypto @cryptocom @kris Hey sis. I started from nothing. Recognised MCO as future of finance and keep supporting until today. I won several competitions and won this swag. Upgraded to Rose Gold and got new swag, then few month ago to Obsidian. Nothing was for free, all earned in 5y. You can do better.","   Hey sis. I started from nothing. Recognised MCO as future of finance and keep supporting until today. I won several competitions and won this swag. Upgraded to Rose Gold and got new swag, then few month ago to Obsidian. Nothing was for free, all earned in 5y. You can do better."
23,"The obvious thing about Crypto is why Satoshi chose this alternate history instead of making himself symbolically rich, simply by mining in advance of the Bitcoin type pioneers or just even after the bubble, also why the reputable technicians keep away until today's dodgy dodgers","The obvious thing about Crypto is why Satoshi chose this alternate history instead of making himself symbolically rich, simply by mining in advance of the Bitcoin type pioneers or just even after the bubble, also why the reputable technicians keep away until today's dodgy dodgers"
24,"Week(s) left for the biggest airdrop in crypto until today, can't be more excited #PulseChain and biggest yield farm will launch on top of it! #PulseX","Week(s) left for the biggest airdrop in crypto until today, can't be more excited PulseChain and biggest yield farm will launch on top of it! PulseX"
25,"When I go out to grab my usual Friday dinner, I like to play a game I call “spot the crypto bro”. Not until today did I realize how wrong many of guesses have been. #cryptobros have a different demeanor sub-2,700","When I go out to grab my usual Friday dinner, I like to play a game I call “spot the crypto bro”. Not until today did I realize how wrong many of guesses have been. cryptobros have a different demeanor sub-2,700"
26,"Interesting fact:

had you invested $1 every day in #bitcoin from 2010 up until today,  you would now have $800 million.

Let that sink in.

#cryptotrading #Crypto #BTC #Ethereum #NFT #HODL #hodling #buythedip","Interesting fact:  had you invested $1 every day in bitcoin from 2010 up until today,  you would now have $800 million.  Let that sink in.  cryptotrading Crypto BTC Ethereum NFT HODL hodling buythedip"
27,"Until today, people would choose platforms to swap crypto for ARS, paying taxes on doing so. Now, with streets cashiers, not only we don't pay taxes anymore: we get paid a lot more, and even have the option to cash out in dollars (far more convenient than inflationary ARS).","Until today, people would choose platforms to swap crypto for ARS, paying taxes on doing so. Now, with streets cashiers, not only we don't pay taxes anymore: we get paid a lot more, and even have the option to cash out in dollars (far more convenient than inflationary ARS)."
28,@intocryptoverse Until today’s crypto traders stop being pu$$ys!!, Until today’s crypto traders stop being pu$$ys!!
29,"@cryptocom hello ... until today I am not allowed to choose from my crypto com wallets .... complete dissatisfaction 🤮..No even after contact with help nothing happened !!!

￼", hello ... until today I am not allowed to choose from my crypto com wallets .... complete dissatisfaction 🤮..No even after contact with help nothing happened !!!  ￼
30,"Hi there!👋 
My twitter will be reborn in the near future. It was created in 2012 for interactions with crypto topics. Until today I used  my acc for observing and receiving some info about projects and tokens, but changes are coming. I will try to explain my thoughts later.🔔","Hi there!👋  My twitter will be reborn in the near future. It was created in 2012 for interactions with crypto topics. Until today I used  my acc for observing and receiving some info about projects and tokens, but changes are coming. I will try to explain my thoughts later.🔔"
31,@relai_app U did put Greece in the but our President have no idea or dont want until today in my knowledge anything with crypto in general.., U did put Greece in the but our President have no idea or dont want until today in my knowledge anything with crypto in general..
32,"@heyibinance Love Binance because of its consistency. Binance able to survive all those hardships until today and keep giving  people hope on the utility and future of Cryptocurrency. 

Binance need to inspire more utility token to expand Crypto Ecosystem as wide as possible. 

💌Binance", Love Binance because of its consistency. Binance able to survive all those hardships until today and keep giving  people hope on the utility and future of Cryptocurrency.   Binance need to inspire more utility token to expand Crypto Ecosystem as wide as possible.   💌Binance
33,"@Crypto__Diva $KDX for sure, the only token i know of until today from a #dex to provide cashflow for owning 

And with their platform, it is gonna get really popular"," $KDX for sure, the only token i know of until today from a dex to provide cashflow for owning   And with their platform, it is gonna get really popular"
34,"Last chance to get 10% OFF. 🚀 Get RAK #antennas and other #Helium accessories for less until today only.

Shop now: https://t.co/LvIzhaYUL3

#crypto #blockchain $HNT #ThePeoplesNetwork https://t.co/DLafsnWH1x",Last chance to get 10% OFF. 🚀 Get RAK antennas and other Helium accessories for less until today only.  Shop now:   crypto blockchain $HNT ThePeoplesNetwork 
35,"@solanium_io @EizperChain @AlamedaResearch @cryptocom @Avocadoguild Please stop putting up NFTs that have no future , until today all NFTs have not been sold , it would be better if I bought slim with these sols than to sit at a loss , but with pictures that no one needs","     Please stop putting up NFTs that have no future , until today all NFTs have not been sold , it would be better if I bought slim with these sols than to sit at a loss , but with pictures that no one needs"
36,@thatcryptopoet @DonnieBigBags @Polkadot Haven't really done that well until today lol. But today I made a little over a $100 I think. It might not seem like much in the crypto or NFT space but when I live around people robbing dudes on the block for $10 and shit just to grab dutches it's definitely worth it🤣,   Haven't really done that well until today lol. But today I made a little over a $100 I think. It might not seem like much in the crypto or NFT space but when I live around people robbing dudes on the block for $10 and shit just to grab dutches it's definitely worth it🤣
37,"@crypto_rudd The projection you made in this Tweet are from January right?

https://t.co/xRQZPOnLTR

Would the lines look different if you recalculated them considering data until today?", The projection you made in this Tweet are from January right?    Would the lines look different if you recalculated them considering data until today?
38,"@Sam_A_Stolt @bimbo_crypto Had no idea you were so new to crypto until today. Keep doing what you're doing and you'll be on top with a quickness!!! My OCD, ADHD, Insomnia and obsession to WIN has made the last 14 months since crypto an insane ride. AM SET AND SUPER STOKED!!!","  Had no idea you were so new to crypto until today. Keep doing what you're doing and you'll be on top with a quickness!!! My OCD, ADHD, Insomnia and obsession to WIN has made the last 14 months since crypto an insane ride. AM SET AND SUPER STOKED!!!"
39,"@CryptoMiguelon If we avoid ww3...... Is realize that we are really early on crypto gaming... All the AAA games now that are preparing have one thing in common, to bring casual players in crypto. When that happen gaming coins and games will see earnings beyond to everything that saw until today"," If we avoid ww3...... Is realize that we are really early on crypto gaming... All the AAA games now that are preparing have one thing in common, to bring casual players in crypto. When that happen gaming coins and games will see earnings beyond to everything that saw until today"
40,"The Nov 2021 price top until today, we see that roughly 210,000 BTC have exited exchanges for a staggering value of $8.19 Billion (once again at $39,000 per/BTC). The accumulation has been very heavy. Something to look forward to

#CryptoNews #ETH #btc #dgcryptotv #crypto https://t.co/HYTTYfI8An","The Nov 2021 price top until today, we see that roughly 210,000 BTC have exited exchanges for a staggering value of $8.19 Billion (once again at $39,000 per/BTC). The accumulation has been very heavy. Something to look forward to  CryptoNews ETH btc dgcryptotv crypto "
41,"@elonmusk Just avoid crypto talk,  your last crypto fun talk here slashed my wallet value by 50% and stayed there for a year or so until today!"," Just avoid crypto talk,  your last crypto fun talk here slashed my wallet value by 50% and stayed there for a year or so until today!"
42,approx 2.5-3 hours until today's coordinated dump and stock market dip. #cryptoiscontrolled #CryptoNews #crypto,approx 2.5-3 hours until today's coordinated dump and stock market dip. cryptoiscontrolled CryptoNews crypto
43,"Never realized how garbage robinhood crypto is until today when tried to send my ETH to my ledger and it told me I can only send $5,000 a day. And that’s not even the end of it… the transaction won’t go through until it’s approved by security even though I confirmed it 3 times.","Never realized how garbage robinhood crypto is until today when tried to send my ETH to my ledger and it told me I can only send $5,000 a day. And that’s not even the end of it… the transaction won’t go through until it’s approved by security even though I confirmed it 3 times."
44,"20. Andre isn’t involved in FTM development a year ago, but he still advised the team until today.

21. Andre vision that he will work on a regulated Crypto project in DeFi. But in short term, he will not come back to Crypto badlands.

RT the first post and thank me later. 😘","20. Andre isn’t involved in FTM development a year ago, but he still advised the team until today.  21. Andre vision that he will work on a regulated Crypto project in DeFi. But in short term, he will not come back to Crypto badlands.  the first post and thank me later. 😘"
45,"A whole anti-vaxx account, who’s spent plenty of time congratulating himself on a Candace Owens response, tweeting crypto nonsense, hating Joe Biden, etc., but never before mentioned either daughter until today, had today’s hit sympathy tweet.

Can’t wait for Elon Musk’s Twitter! https://t.co/SgA35wMvdO","A whole anti-vaxx account, who’s spent plenty of time congratulating himself on a Candace Owens response, tweeting crypto nonsense, hating Joe Biden, etc., but never before mentioned either daughter until today, had today’s hit sympathy tweet.  Can’t wait for Elon Musk’s Twitter! "
46,only 20min or so until today's stock market #crypto dump. opening bigger shorts to take advantage of the #cryptomanipulation this morning. going to be a bloodbath.,only 20min or so until today's stock market crypto dump. opening bigger shorts to take advantage of the cryptomanipulation this morning. going to be a bloodbath.
47,Traditional Investors laughed at crypto volatility until today has wiped out years of returns from stocks....haha? #btc #crypto #FTM #LQDR,Traditional Investors laughed at crypto volatility until today has wiped out years of returns from stocks....haha? btc crypto FTM LQDR
48,"When #IBC was activated on secret-4 last year, ✅ @Crypto_Crew #Validators established the first channels to @osmosiszone, @cosmos &amp; @terra_money $OSMO $ATOM $LUNA 

With over 120k txs relayed on secret until today, we are one of the most active ibc-relayers on the network","When IBC was activated on secret-4 last year, ✅  Validators established the first channels to ,  &amp;  $OSMO $ATOM $LUNA   With over 120k txs relayed on secret until today, we are one of the most active ibc-relayers on the network"
49,"Fuck elon musk , but a lot of yall are acting as if up until today twitter was owned by an anticapitalist freedom fighter and not just another billionaire crypto weirdo","Fuck elon musk , but a lot of yall are acting as if up until today twitter was owned by an anticapitalist freedom fighter and not just another billionaire crypto weirdo"
50,"If you'd held on to your first ever crypto purchase until today, where would you be at now?","If you'd held on to your first ever crypto purchase until today, where would you be at now?"
51,@hbarmy_hedera @pattni_c Price performance for all #crypto including  #HBAR is measured from #HBAR open access until today.,  Price performance for all crypto including  HBAR is measured from HBAR open access until today.
52,"didn't think about this until today 🤓 but now that I've seen this, it's on my list 🧙‍♂️🔥🚀

PS: crypto 1st. Then this. https://t.co/7ct1aoj8it","didn't think about this until today 🤓 but now that I've seen this, it's on my list 🧙‍♂️🔥🚀  PS: crypto 1st. Then this. "
53,My fiancé minted @crypto_coven. I held on minting b/c of irl stress at the time. Months later he sold his witches without telling me. I never got over that betrayal until today. ❤️‍🔥 now we can finally live in harmony again 🔮,My fiancé minted . I held on minting b/c of irl stress at the time. Months later he sold his witches without telling me. I never got over that betrayal until today. ❤️‍🔥 now we can finally live in harmony again 🔮
54,"@BDonnellyarch Agreed. All equity markets are in full drawdown mode. It's too bad because crypto was looking joocy until today, but there's not 1 redeeming quality in the equities markets at the moment. If equity markets tank, sad to say but crypto will tank harder."," Agreed. All equity markets are in full drawdown mode. It's too bad because crypto was looking joocy until today, but there's not 1 redeeming quality in the equities markets at the moment. If equity markets tank, sad to say but crypto will tank harder."
55,someone the other day said women were suspicious of crypto risks. i thought they were off until today i said i don't like the risks in regards to flipping on eth 😅 ¯\_(ツ)_/¯,someone the other day said women were suspicious of crypto risks. i thought they were off until today i said i don't like the risks in regards to flipping on eth 😅 ¯\_(ツ)_/¯
56,"⚽️I bet you will not miss this opportunity given by @scorefamsports
📌Participate on the #IDO now. Go to @CoinSwap_Space spacePad: https://t.co/bCC8a5CHYx
⏳Until today only, don't think too long you might missed it.
#betting #sports #nft #cryptocurrency #Blockchain #DeFi #Crypto https://t.co/oEscNA6MdD","⚽️I bet you will not miss this opportunity given by  📌Participate on the IDO now. Go to  spacePad:  ⏳Until today only, don't think too long you might missed it. betting sports nft cryptocurrency Blockchain DeFi Crypto "
57,"⚽ @scorefamsports IDO is ongoing now on our 🚀spacePad!

⏰ Timeline: Until today April 21st at 1 PM UTC
🌐 Link: https://t.co/4SRE2eqz5h

Join now and be part of this exceptional launch! 💪

#CoinswapSpace #DeFi @SportsCenter #AMM @binance #Crypto @br_betting #IDO https://t.co/5b92uMeNpH",⚽  IDO is ongoing now on our 🚀spacePad!  ⏰ Timeline: Until today April 21st at 1 PM UTC 🌐 Link:   Join now and be part of this exceptional launch! 💪  CoinswapSpace DeFi  AMM  Crypto  IDO 
58,It wasn't until today that I realized that Sh** S*rr*n* was a film guy and not a crypto bro or some kind of fascist.,It wasn't until today that I realized that Sh** S*rr*n* was a film guy and not a crypto bro or some kind of fascist.
59,@bigdsenpai @GCBirdman In true crypto degen fashion I’m waiting until today to see if I need to file an extension. Mostly bc our local crypto accountant is in way above his head 🤦‍♂️,  In true crypto degen fashion I’m waiting until today to see if I need to file an extension. Mostly bc our local crypto accountant is in way above his head 🤦‍♂️
60,"TICK TACK.... ⏰ Auction is arriving at its end! GET YOURS! 😉
💰Starting Price 1.50 ETH
🔔You have time until today April 18 at 20h pm GMT.
Get yours at 👉 https://t.co/rI6v1gCcyu

#thousandfaces #nftart #cryptoart #art #digitalart #crypto #bitcoin #NFT #NFTs #blockchain https://t.co/n6uSgeDGVN",TICK TACK.... ⏰ Auction is arriving at its end! GET YOURS! 😉 💰Starting Price 1.50 ETH 🔔You have time until today April 18 at 20h pm GMT. Get yours at 👉   thousandfaces nftart cryptoart art digitalart crypto bitcoin NFT NFTs blockchain 
61,"@crypto_soundman @fuzzyfelons Haha I figured that might be the case! I forgot Easter was a thing until today.
Thanks for the update and the awesome giveaway friend!",  Haha I figured that might be the case! I forgot Easter was a thing until today. Thanks for the update and the awesome giveaway friend!
62,@SmolPotions @BattleFlyGame Had a stressful week coz on Monday i traveled to a state that made me spent over 500km during the trip in a car. Came back Wednesday and was very stressed out so I haven't really focused on crypto space until today.,  Had a stressful week coz on Monday i traveled to a state that made me spent over 500km during the trip in a car. Came back Wednesday and was very stressed out so I haven't really focused on crypto space until today.
63,@GeeYaRald Well maybe crypto goes up and nft goes down.. lots of big WL upcoming and market volume is getting weaker (until today) i think moon birds might sit around 5-6, Well maybe crypto goes up and nft goes down.. lots of big WL upcoming and market volume is getting weaker (until today) i think moon birds might sit around 5-6
64,@Crypto_Gramp HAHAHAHA broooo pleaseeee. I didn’t see you follow me before until today!, HAHAHAHA broooo pleaseeee. I didn’t see you follow me before until today!
