,Tweets,cleanedTweets
498,"Just under 3 hours until today’s #CoindorPoll is over! 

Who will be today’s champions?

@radixdlt @L1SToken @argonfoundation @Phoenix_Crypto_  @Mil_Finance 

Join, vote &amp; comment for your chance to win $50! 👇

https://t.co/wRcV5Yeq8Z

#BSCGems #moonshots #crypto #Giveaways #bnb","Just under 3 hours until today’s CoindorPoll is over!   Who will be today’s champions?          Join, vote &amp; comment for your chance to win $50! 👇    BSCGems moonshots crypto Giveaways bnb"
499,"@Crypto_Snazzy 1. All mined coins (total supply), from the genesis block until today, are still in circulation (circulating supply). 

We will reach maximum supply once all the coins have been mined.

2. Your question isn’t very clear to me. Market decides on the price."," 1. All mined coins (total supply), from the genesis block until today, are still in circulation (circulating supply).   We will reach maximum supply once all the coins have been mined.  2. Your question isn’t very clear to me. Market decides on the price."
500,"@ProAutoTrader @crypto_NinAda Yesterday I posted this: https://t.co/kzFnXl8atG
Until today, I thought on 9/25 Tanzania would be the CBDC because World Mobile is building there so my guess was that","  Yesterday I posted this:  Until today, I thought on 9/25 Tanzania would be the CBDC because World Mobile is building there so my guess was that"
501,"@Daga11022 @CryptoPennyCO Actually I totally forgot I cashed out around 20% of my crypto a few months ago. So I'd say I'm roughly even from 2017, which still sucks. If I just held until today I'd be up almost  10x, but even that is flawed logic because I would have had to sell at the right time","  Actually I totally forgot I cashed out around 20% of my crypto a few months ago. So I'd say I'm roughly even from 2017, which still sucks. If I just held until today I'd be up almost  10x, but even that is flawed logic because I would have had to sell at the right time"
502,after almost 6 months i’ve finally made real money on my crypto investment 😭 i gave up on it and didnt check on it until today,after almost 6 months i’ve finally made real money on my crypto investment 😭 i gave up on it and didnt check on it until today
503,"Haven’t really delved into the #nft side of things in crypto until today

@heaven_computer is one of the only ones I’ve ever minted this szn and already up 3x hours later

wtf lol https://t.co/xqF2j4Eiqn https://t.co/rtdrCE0svl",Haven’t really delved into the nft side of things in crypto until today   is one of the only ones I’ve ever minted this szn and already up 3x hours later  wtf lol  
504,"@Smart_NFT_News @ethernaal What a unique concept, i didnt know about this until today. What a good way to start investing, congratulations @ethernaal for this concept that will probably make changes in the crypto world.","  What a unique concept, i didnt know about this until today. What a good way to start investing, congratulations  for this concept that will probably make changes in the crypto world."
505,"@SBF_FTX  @SBF_Alameda  please, In March I made a request, at the same time I know that it has been passed on internally, but until today they have not included FTX in the tradingview crypto screener list https://t.co/uj8FihhWB2","    please, In March I made a request, at the same time I know that it has been passed on internally, but until today they have not included FTX in the tradingview crypto screener list "
506,"@DujunX I'm new in crypto, so honestly, I have never heard about #Huobi until today. I hope I can still join your giveaway though. I'd love to have some. 😁😉💚

@BarczaSzandra @yburada1289 @eybyoung"," I'm new in crypto, so honestly, I have never heard about Huobi until today. I hope I can still join your giveaway though. I'd love to have some. 😁😉💚    "
507,"@GarethSoloway By the way I have been watching you for a long time, long before I got into crypto on kitco news.

I always appreciate your input and directional sense.  Just this last call of a failure to me seems odd since it was up like every day until today"," By the way I have been watching you for a long time, long before I got into crypto on kitco news.  I always appreciate your input and directional sense.  Just this last call of a failure to me seems odd since it was up like every day until today"
508,"1) Heart goes out to anyone effected 

2) Crazy how big crypto is getting that a network I had not previously heard about until today is part of the biggest hack in history.",1) Heart goes out to anyone effected   2) Crazy how big crypto is getting that a network I had not previously heard about until today is part of the biggest hack in history.
509,Did not know Gene Simmons of Kiss was really into crypto until today https://t.co/tLM6ddcBK7,Did not know Gene Simmons of Kiss was really into crypto until today 
510,@RobertEstrada8 @Croesus_BTC @tedcruz @marcorubio I didn't know crypto was a partisan thing until today. Sucks.,    I didn't know crypto was a partisan thing until today. Sucks.
511,"The other day somebody told me I have no self respect because I started to focus on #crypto instead of traditional asset classes. Obviously, I thought they were idiots.... Until today. Because today, I bought $DOGE

#crypto #cryptotrading","The other day somebody told me I have no self respect because I started to focus on crypto instead of traditional asset classes. Obviously, I thought they were idiots.... Until today. Because today, I bought $DOGE  crypto cryptotrading"
512,@CryptoBeatniks @crypto_banter @cryptomanran @APompliano @Sheldon_Sniper Is anyone else from South Africa struggling to do payments on binance with card. Mine was declined and when I wanted to add new card  there isn't even an option. This was all fine until today,     Is anyone else from South Africa struggling to do payments on binance with card. Mine was declined and when I wanted to add new card  there isn't even an option. This was all fine until today
513,@CharlesPatte until today only. I'm late to know this event! can buy more if I knew earlier. #Banxa #crypto #bitcoin, until today only. I'm late to know this event! can buy more if I knew earlier. Banxa crypto bitcoin
514,"I've never had a dream about crypto until today. Its 6am here. #BTC will see green candles like never before. Make my words!
#HBARbarians we gnna eat soon inshallah",I've never had a dream about crypto until today. Its 6am here. BTC will see green candles like never before. Make my words! HBARbarians we gnna eat soon inshallah
515,"Scammer tried to scam me but I tricked him and scammed him instead. #crypto #defi #BTC #ETH #TRX

So up until today, I've got 3 scammers PM me and say that they own a company and that they can increase my profits (this is the most basic type of scam imo.) I made a post some …","Scammer tried to scam me but I tricked him and scammed him instead. crypto defi BTC ETH TRX  So up until today, I've got 3 scammers PM me and say that they own a company and that they can increase my profits (this is the most basic type of scam imo.) I made a post some …"
516,"@BenTilly4 @onionzz5 @TPCLJ LOL - are you asking me? I have heard of crypto-currency, but I have not invested (never heard of this until today) and no one has paid me anything for anything. On paper or any other way. So little facts, so many accusations.","   LOL - are you asking me? I have heard of crypto-currency, but I have not invested (never heard of this until today) and no one has paid me anything for anything. On paper or any other way. So little facts, so many accusations."
517,"My entry for this weeks #Thunderdome @orphan_crypto w/@_KidEight 

Done in 5hrs cause I didn't see the competition until today 🙃

HATE/LOVE

#NFTCommunity https://t.co/6Symlu9Iux",My entry for this weeks Thunderdome  w/   Done in 5hrs cause I didn't see the competition until today 🙃  HATE/LOVE  NFTCommunity 
518,Just got off the phone w/ @Chase. I have been able to make debit card cryptocurrency purchases up until today. Now I HAVE to do an ACH transfer which takes days. I should be able to do w/ my hard earned money what I want. This shit is getting out of hand. #crypto  #bitcoin,Just got off the phone w/ . I have been able to make debit card cryptocurrency purchases up until today. Now I HAVE to do an ACH transfer which takes days. I should be able to do w/ my hard earned money what I want. This shit is getting out of hand. crypto  bitcoin
519,@fintechfrank I’m presumably less crypto focused and literally hadn’t heard about it until today, I’m presumably less crypto focused and literally hadn’t heard about it until today
520,@r0okClothing That shows how much $r0ok cares for little guys like me. People are aware of the problem but none stepped out of their way until today. Thanks so much 💕🎉💯🙏🚀 #Crypto #bnb  #Mentalhealth, That shows how much $r0ok cares for little guys like me. People are aware of the problem but none stepped out of their way until today. Thanks so much 💕🎉💯🙏🚀 Crypto bnb  Mentalhealth
521,"I bought a bunch of random crypto currency’s in 2018 and totally forgot about it until today. Lets just say, daddy’s about to buy a brand new refurbished IPhone 9 baby!","I bought a bunch of random crypto currency’s in 2018 and totally forgot about it until today. Lets just say, daddy’s about to buy a brand new refurbished IPhone 9 baby!"
522,@TTavias @sfchronicle Exactly been in crypto for 4 years never heard of this being an issue until today. good sign it’s complete bullshit. Most women just don’t care about investing in it.,  Exactly been in crypto for 4 years never heard of this being an issue until today. good sign it’s complete bullshit. Most women just don’t care about investing in it.
523,"From May 22th (the big dump), until today @PurposeInvest increased #Bitcoin holdings substantially. 

A shout out to @CryptosR_Us for putting me on the right track regarding this indicator.

Retail remains cautious, VC's obviously not.

#BTC #CryptoNews #Cryptocurrency #Crypto https://t.co/N9ltGsydYm","From May 22th (the big dump), until today  increased Bitcoin holdings substantially.   A shout out to  for putting me on the right track regarding this indicator.  Retail remains cautious, VC's obviously not.  BTC CryptoNews Cryptocurrency Crypto "
524,"Up until today we uphold the decision, of implementing everything from scratch. The code base is enormous. It would be literally impossible for an external team to be introducing quality updates at a timely AND *safe* manner. That's how we perceived Eth years back. 

#crypto","Up until today we uphold the decision, of implementing everything from scratch. The code base is enormous. It would be literally impossible for an external team to be introducing quality updates at a timely AND *safe* manner. That's how we perceived Eth years back.   crypto"
525,@NeilJacobs Crypto Twitter was dead for weeks … until today. https://t.co/RxrQBlvdDu, Crypto Twitter was dead for weeks … until today. 
526,"I didn’t realize how much I enjoyed $BTC not playing on the main stage these past few weeks until today. Based on limited Tweets recently, I almost forgot about crypto.","I didn’t realize how much I enjoyed $BTC not playing on the main stage these past few weeks until today. Based on limited Tweets recently, I almost forgot about crypto."
527,"@El_Crypto_Chapo True, we had a 5 straight days of pumping until today sharp quick pump so hoped for a pullback for dip buying"," True, we had a 5 straight days of pumping until today sharp quick pump so hoped for a pullback for dip buying"
528,"2) we are the first #cryptogame to do that in the crypto-space and more specifically we are first to do that on #Cardano.
3) Crypto gaming is a trending field. 
4) Currently we are fundless. This means that what is released until today or in next days is a product of free work.",2) we are the first cryptogame to do that in the crypto-space and more specifically we are first to do that on Cardano. 3) Crypto gaming is a trending field.  4) Currently we are fundless. This means that what is released until today or in next days is a product of free work.
529,"I’ve never agreed with Kim Jon Un until today. 🤣 #Bitcoin #Crypto
 https://t.co/d0v78dtQuD",I’ve never agreed with Kim Jon Un until today. 🤣 Bitcoin Crypto  
530,@hodl_gorilla Dude sounds like he’s 90% Bitcoin 10% shitcoin was my take away on his “crypto” holdings outside Tesla and space-x. I had no idea how other company purchased until today like you. Which is about average for noobs here for 2-3 years. That will increase over time. Cathie knew. Lol., Dude sounds like he’s 90% Bitcoin 10% shitcoin was my take away on his “crypto” holdings outside Tesla and space-x. I had no idea how other company purchased until today like you. Which is about average for noobs here for 2-3 years. That will increase over time. Cathie knew. Lol.
531,"As #BSV  proves it can do what others can't, notice how these attacks on BSV are so well coordinated 

Even @RobinhoodApp is now spreading the FUD. 

 All Robinhood's crypto has News Expect BSV. 

Until today and what does it say?

''Binance Pool to Halt BSV Mining Services'' https://t.co/Gb0RObRjl9","As BSV  proves it can do what others can't, notice how these attacks on BSV are so well coordinated   Even  is now spreading the FUD.    All Robinhood's crypto has News Expect BSV.   Until today and what does it say?  ''Binance Pool to Halt BSV Mining Services'' "
532,"A pretty bearish month up until today, I still earn on average $210 per day from my crypto portfolio. #DeFi #CRV #CVX","A pretty bearish month up until today, I still earn on average $210 per day from my crypto portfolio. DeFi CRV CVX"
533,"July 30th #BTC Contract - We have been watching the 45K Call be the Highest OI Call in the market until today when it dipped down to a level similar to the highest OI Put at 30K.

The 200K DEC Call is now the highest OI

#BitcoinCrash #Bitcoin #cryptocurrency #CryptoNews #Crypto https://t.co/o4dt9lutZy",July 30th BTC Contract - We have been watching the 45K Call be the Highest OI Call in the market until today when it dipped down to a level similar to the highest OI Put at 30K.  The 200K DEC Call is now the highest OI  BitcoinCrash Bitcoin cryptocurrency CryptoNews Crypto 
534,"@DogecoinRise I had diamond hands until today. It's over. When the co-creator comes out and single handedly crashes almost every crypto platform out there, it's over. I made 5x what I invested so I'm happy. But kicking myself for not getting out at over .70. Is what it is."," I had diamond hands until today. It's over. When the co-creator comes out and single handedly crashes almost every crypto platform out there, it's over. I made 5x what I invested so I'm happy. But kicking myself for not getting out at over .70. Is what it is."
535,@Baoshikawaowwa1 I bought a ledger within 6 months of getting into crypto in 17-18 never used it until today tho, I bought a ledger within 6 months of getting into crypto in 17-18 never used it until today tho
536,"I never would have entertained the idea of no BTC, no ETH, no DOGE....UNTIL TODAY! Do your research people. Even if you hold tight to these crypto investments,  you NEED to have the things on the Interledger Protocol ASAP!","I never would have entertained the idea of no BTC, no ETH, no DOGE....UNTIL TODAY! Do your research people. Even if you hold tight to these crypto investments,  you NEED to have the things on the Interledger Protocol ASAP!"
537,@crypto_news_19 I never noticed your FUD until today.. someone fire this bot, I never noticed your FUD until today.. someone fire this bot
538,@Teaching_Crypto Interesting... tell me more... I couldn’t say until today... 🤣😂 https://t.co/7KwCG6swRi, Interesting... tell me more... I couldn’t say until today... 🤣😂 
539,"until today it all was done by Free Work - Voltunary Work ! from intelligent &amp;  Goodhearted Developers.

they even paid some expenses out of their personal money to get it where we are today.

the people behind is like no other project in crypto i have heard about🙏",until today it all was done by Free Work - Voltunary Work ! from intelligent &amp;  Goodhearted Developers.  they even paid some expenses out of their personal money to get it where we are today.  the people behind is like no other project in crypto i have heard about🙏
540,"Fellows... normal, not normal.

Until today, ads without opting out for crypto shit in TEXAS and FLORIDA

Who is the hack behind these?","Fellows... normal, not normal.  Until today, ads without opting out for crypto shit in TEXAS and FLORIDA  Who is the hack behind these?"
541,@RealFlokiInu I don’t complain about money it’s crypto but from1.7B I got 51M and was trying to transfer on uniswap since yesterday at least 3 times did not succeed  the new address was not able until today afternoon.I can understand many things but what u guys did is wrong .., I don’t complain about money it’s crypto but from1.7B I got 51M and was trying to transfer on uniswap since yesterday at least 3 times did not succeed  the new address was not able until today afternoon.I can understand many things but what u guys did is wrong ..
542,@Sokercat @BTC_Archive @binance @EveryBitHelps_ @cz_binance Until today no taxes whatsoever on crypto similar to gold for example. I believe this is quite friendly also the government has preference for tech companies coming to the country so very friendly. Not at all like Spain. The Portuguese government would welcome @binance,     Until today no taxes whatsoever on crypto similar to gold for example. I believe this is quite friendly also the government has preference for tech companies coming to the country so very friendly. Not at all like Spain. The Portuguese government would welcome 
543,"Came across @AxieInfinity a year ago &amp; wondered how can a user benefit in crypto gaming. 

Was skeptical until I started to try getting my own Axie and try it out, and then I was bullish on it until today. 

Looking at the players revenues, I merely believe this is just a start. https://t.co/Bvdl4niClh","Came across  a year ago &amp; wondered how can a user benefit in crypto gaming.   Was skeptical until I started to try getting my own Axie and try it out, and then I was bullish on it until today.   Looking at the players revenues, I merely believe this is just a start. "
544,My entire feed was crypto until today. https://t.co/FOC7wQYa30,My entire feed was crypto until today. 
545,@cryptocom  any reason why restaking cro on defi would not be working? Was working  fine until today and it won’t now…,  any reason why restaking cro on defi would not be working? Was working  fine until today and it won’t now…
546,@coinbase I don't think my crypto is gone and I have no return until today, I don't think my crypto is gone and I have no return until today
547,"@Awoolii crypto, a character I didn't know existed until today"," crypto, a character I didn't know existed until today"
548,"@cryptocclub01 @sportemongo Can you tell us about the successes of the project from the beginning until today? and does your project plan to partner with local crypto developers in each country to make token usage more global?

@sklly07 @jkokatjuhha @jkokladas",  Can you tell us about the successes of the project from the beginning until today? and does your project plan to partner with local crypto developers in each country to make token usage more global?    
549,@hoopsjock As a Blazers fan and crypto user I think it’s okay. Never heard of StormX until today but will dive into the white paper and see what’s up., As a Blazers fan and crypto user I think it’s okay. Never heard of StormX until today but will dive into the white paper and see what’s up.
550,"Until today, #German funds were barred from investing in #crypto. A new law has passed allowing funds to allocate up to 20% to the #asset class.

https://t.co/ejCghJAlKe","Until today, German funds were barred from investing in crypto. A new law has passed allowing funds to allocate up to 20% to the asset class.  "
551,"German Law Could Lead to $415B Crypto Investment

Until today, German funds were barred from investing in crypto. A new law has passed allowing funds to allocate up to 20% to the asset class.","German Law Could Lead to $415B Crypto Investment  Until today, German funds were barred from investing in crypto. A new law has passed allowing funds to allocate up to 20% to the asset class."
552,"""Until today, German funds were barred from investing in crypto. A new law has passed allowing funds to allocate up to 20% to the asset class."" @CryptoBriefing 
https://t.co/VVWtd5qg9j https://t.co/PuIS6MaU7A","""Until today, German funds were barred from investing in crypto. A new law has passed allowing funds to allocate up to 20% to the asset class.""    "
553,@TheChartArtist Watch you today on Banter. I'm 8 months into crypto .Never understood fib tool until today. To accumulate btc I'm on loan 2k buying all in taking profits on way up slowly paying of my loan. Is this stupid strategy?, Watch you today on Banter. I'm 8 months into crypto .Never understood fib tool until today. To accumulate btc I'm on loan 2k buying all in taking profits on way up slowly paying of my loan. Is this stupid strategy?
554,"@CashApp @theestallion God bless 🙏🏼, I never got anything from cash app until today, thank you cash app, thank you Megan the Stallion, and thank you God. I will continue to learn about investing in stocks and crypto, eventually real estate are all the goals 📈🚀🌕","  God bless 🙏🏼, I never got anything from cash app until today, thank you cash app, thank you Megan the Stallion, and thank you God. I will continue to learn about investing in stocks and crypto, eventually real estate are all the goals 📈🚀🌕"
555,@KingDoggoXRP That was Doggo in the crypto market until today...😂😂. Feeling better all of a sudden., That was Doggo in the crypto market until today...😂😂. Feeling better all of a sudden.
556,"@Infinity_AMA @sportemongo Can you tell us about the successes of the project from the beginning until today? and does your project plan to partner with local crypto developers in each country to make token usage more global?
@eserr @terkipd",  Can you tell us about the successes of the project from the beginning until today? and does your project plan to partner with local crypto developers in each country to make token usage more global?  
557,"May 18, 2021:

Why #Crypto Has NOT Topped https://t.co/Qgw2AXQrqG

And every single day until today, June 28, 2021:  #Cryptocurrency has NOT topped

Educated Logic over Blind Emotions

#bitcoin $btc #xrpcommunity #hbarbarians #linkmarines $xrp $xlm $hbar $one $mana $link $matic","May 18, 2021:  Why Crypto Has NOT Topped   And every single day until today, June 28, 2021:  Cryptocurrency has NOT topped  Educated Logic over Blind Emotions  bitcoin $btc xrpcommunity hbarbarians linkmarines $xrp $xlm $hbar $one $mana $link $matic"
558,"@crypto_lavazar @merchant_token Hi, I've already change twice my withdrawal ETH address on my Merchant Token Launchpad but until today I did not understand that a classic Exchange ETH ERC-20 address such as my Binance account will not work. What can I do ? What will happend ?","  Hi, I've already change twice my withdrawal ETH address on my Merchant Token Launchpad but until today I did not understand that a classic Exchange ETH ERC-20 address such as my Binance account will not work. What can I do ? What will happend ?"
559,"While we introduced tokenized stocks Q4 of last year to some of the world's biggest crypto trading venues, it was also Ltd by only allowing users to open or close pos. 
Until today, most tokenized stocks were non transferable and could not be wd from exchanges. That’s changed.","While we introduced tokenized stocks Q4 of last year to some of the world's biggest crypto trading venues, it was also Ltd by only allowing users to open or close pos.  Until today, most tokenized stocks were non transferable and could not be wd from exchanges. That’s changed."
560,"China FUD is just that... I've heard the exact same stories since I was in crypto in China in 2016, 2017, 2018, 2019 and until today. But you know what else, not a single Chinese investor, team, or even (banned) exchanges I know have quit, and miners are relocating. #HODL","China FUD is just that... I've heard the exact same stories since I was in crypto in China in 2016, 2017, 2018, 2019 and until today. But you know what else, not a single Chinese investor, team, or even (banned) exchanges I know have quit, and miners are relocating. HODL"
561,"Yoooo…. I been so invested into so many different projects that I didn’t even check my crypto portfolio until today. 

My whole portfolio is screaming “SUWHOOP” cuz it’s all red! SMDH 😂🤦🏿‍♂️

BUY THE DIP though!",Yoooo…. I been so invested into so many different projects that I didn’t even check my crypto portfolio until today.   My whole portfolio is screaming “SUWHOOP” cuz it’s all red! SMDH 😂🤦🏿‍♂️  BUY THE DIP though!
562,"@SiglerJustin I stopped buying crypto in 2013 (bitcoin buying and selling). I never bought dogecoin, I mined it.

Until today."," I stopped buying crypto in 2013 (bitcoin buying and selling). I never bought dogecoin, I mined it.  Until today."
