,Tweets,cleanedTweets
258,"Crypto markets doing exactly as Arthur Hayes blog post from December described, but crypto twitter tards caught off guard somehow. Do yourself a favour and unfollow someone who was bullish since mid 50s and called bottom with total confidence until today’s drop https://t.co/bjPfz8XCT2","Crypto markets doing exactly as Arthur Hayes blog post from December described, but crypto twitter tards caught off guard somehow. Do yourself a favour and unfollow someone who was bullish since mid 50s and called bottom with total confidence until today’s drop "
259,"It’s #WomenInCrypto day, which I didn’t even know was a thing until today! Never would I have expected to be a woman in crypto myself, but I am proud to be a part of this amazing community! Here’s to all the amazing and talented women who inspire, encourage, and support me 🥂","It’s WomenInCrypto day, which I didn’t even know was a thing until today! Never would I have expected to be a woman in crypto myself, but I am proud to be a part of this amazing community! Here’s to all the amazing and talented women who inspire, encourage, and support me 🥂"
260,"@Crypto_Ninja007 Only when we have major changes and I find some time to do so 😃 The last video is still relevant until today, because I generally give longer term forecasts that are usually valid for several weeks, sometimes even months before they fully play out 🍻"," Only when we have major changes and I find some time to do so 😃 The last video is still relevant until today, because I generally give longer term forecasts that are usually valid for several weeks, sometimes even months before they fully play out 🍻"
261,$PLTR I haven’t bought any crypto and stocks this year until today. This is such a great buy here,$PLTR I haven’t bought any crypto and stocks this year until today. This is such a great buy here
262,"@JayJaboneta @Cryptocito @johnniecosmos @L1am_Crypto @DocumentingATOM @CosmosEcosystem @Wickex2 @osmosiszone @sifchain @emerisHQ I've been wanting to get on the train for a while, but haven't pulled the trigger until today, #FOMO. 

Been under the same impression as you are about tech &amp; price for a long time, suddenly news come out that hits like a bus. 

Gonna dig into it :) thanks!","          I've been wanting to get on the train for a while, but haven't pulled the trigger until today, FOMO.   Been under the same impression as you are about tech &amp; price for a long time, suddenly news come out that hits like a bus.   Gonna dig into it :) thanks!"
263,@Crypto_Marginal @cappasity 4 years CAPP launch their ICO .. and until today just 1 exchange... I see CAPPASITY just focus in business ( product ) and don't care about the Token CAPP .,  4 years CAPP launch their ICO .. and until today just 1 exchange... I see CAPPASITY just focus in business ( product ) and don't care about the Token CAPP .
264,I've never seen those crypto brothers until today and now I yearn to go back,I've never seen those crypto brothers until today and now I yearn to go back
265,"Patience will win in the long-term
patience is key
bitcoin etherium  other crypto tokens or crypto market
until today
how many times fell 50-60-70-80 percent
those who are patient are now millionaires

PS: this post is not mine. Taking from $LEOS telegram.❤️",Patience will win in the long-term patience is key bitcoin etherium  other crypto tokens or crypto market until today how many times fell 50-60-70-80 percent those who are patient are now millionaires  PS: this post is not mine. Taking from $LEOS telegram.❤️
266,"Mehn... Wish these people can be paying my pension into a crypto wallet for me.

I used a #1000 promo in 2019 to buy bitcoin and I forgot it until today when I saw a list of crypto company in Nigeria and I checked the forgotten wallet this morning, 1k don turn 18k.

Mehn!!!","Mehn... Wish these people can be paying my pension into a crypto wallet for me.  I used a 1000 promo in 2019 to buy bitcoin and I forgot it until today when I saw a list of crypto company in Nigeria and I checked the forgotten wallet this morning, 1k don turn 18k.  Mehn!!!"
267,"@BlockOwls @NP_DemonS @CryptoRaggies @Cardano This game I never heard of until today was retweeted to me by a  demon! 😈😏

That sounds strange, and I promise I'm not lying. Nonetheless, I need to do my own research &amp; look into this crypto raggies?!😺 Last time I fell for something soooo cute...

I followed...forever 😁","    This game I never heard of until today was retweeted to me by a  demon! 😈😏  That sounds strange, and I promise I'm not lying. Nonetheless, I need to do my own research &amp; look into this crypto raggies?!😺 Last time I fell for something soooo cute...  I followed...forever 😁"
268,If your new to crypto maybe you don't know how significant this is right here. Since the 1st of 2021 until today #Bitcoin has spent 257 days trading above 40K and the rest of the time 108 days trading in a range from 28K-40K. An entire year above it previous blow off top at 20K! https://t.co/PFeCzK1JC6,If your new to crypto maybe you don't know how significant this is right here. Since the 1st of 2021 until today Bitcoin has spent 257 days trading above 40K and the rest of the time 108 days trading in a range from 28K-40K. An entire year above it previous blow off top at 20K! 
269,with all my learning about crypto and NFTs I have avoided getting involved with NFT art in any way. Until today. An artist I have followed and supported for years (@Meerkatsu) minted exactly 9.,with all my learning about crypto and NFTs I have avoided getting involved with NFT art in any way. Until today. An artist I have followed and supported for years () minted exactly 9.
270,@Quinnvestments I've been looking at you and another individual talk about Bitcoin for weeks now. You know your take 😌 his take on all other crypto has been spot on 💯 but Bitcoin he's been Bullish on UNTIL TODAY 😂 https://t.co/bjzZqdEoEk, I've been looking at you and another individual talk about Bitcoin for weeks now. You know your take 😌 his take on all other crypto has been spot on 💯 but Bitcoin he's been Bullish on UNTIL TODAY 😂 
271,Never in my life have I felt that I have a chance of having more money than I know what to do with. Until Today. And if I do make a crazy amount I’m helping mad people. Main goal will be to make more and help more. WAGMI #SAFEMOON #SAFEMOONARMY #SAFEMOONV2 #Crypto,Never in my life have I felt that I have a chance of having more money than I know what to do with. Until Today. And if I do make a crazy amount I’m helping mad people. Main goal will be to make more and help more. WAGMI SAFEMOON SAFEMOONARMY SAFEMOONV2 Crypto
272,@Crypto_zebra @cryptosfaucets I made two withdrawals before Christmas and until today nothing,  I made two withdrawals before Christmas and until today nothing
273,"I did not know that @lexfridman did a podcast with @silviomicali until today, big fans of both these guys.

If you missed it like me, give a listen below 👇 #Algorand $algo #Crypto #blockchain 

 https://t.co/h8qzSREItR","I did not know that  did a podcast with  until today, big fans of both these guys.  If you missed it like me, give a listen below 👇 Algorand $algo Crypto blockchain    "
274,"Was a great session.i was seeing crypto like its something only made for 1 set of people until today
Terms like centralized finances decentralised excange binance metamax etc 

This was an eye opener for me and a step of owning my own empire

Thanks 
@RealDreylo X @EVGCCommunity",Was a great session.i was seeing crypto like its something only made for 1 set of people until today Terms like centralized finances decentralised excange binance metamax etc   This was an eye opener for me and a step of owning my own empire  Thanks   X 
275,i'm embarrassed because i didn't know those crypto heirloom leaks were fake until today and now i am crying what the hell is this 💀,i'm embarrassed because i didn't know those crypto heirloom leaks were fake until today and now i am crying what the hell is this 💀
276,"Hey Twitter, I dropped off the platform from 2017 until today - decided to rejoin  &amp; rebuild! Who should I follow for the smartest #Crypto #nft &amp; #web3 insight?","Hey Twitter, I dropped off the platform from 2017 until today - decided to rejoin  &amp; rebuild! Who should I follow for the smartest Crypto nft &amp; web3 insight?"
277,"@Dash_Community Where would someone completely
oblivious to the existence of #Dash until today, find that information?
1. They could do their own research,
or
2. You could provide a ""link"" that leads to more information to this #Mastercard App...
imho
A credit card defies the purpose of crypto."," Where would someone completely oblivious to the existence of Dash until today, find that information? 1. They could do their own research, or 2. You could provide a ""link"" that leads to more information to this Mastercard App... imho A credit card defies the purpose of crypto."
278,"I sell the same CBD on my website @vapeandjuiceuk that Boots a major retailer does

We use the same payment gateway...until today when they pulled the plug

But only for us..

On 1 of the best retail days in a year, because we sell CBD

Why I hate TradFi - Yes we take #Crypto","I sell the same CBD on my website  that Boots a major retailer does  We use the same payment gateway...until today when they pulled the plug  But only for us..  On 1 of the best retail days in a year, because we sell CBD  Why I hate TradFi - Yes we take Crypto"
279,"I am appreciative of @crypto_spot taking the time to put this thread together, for a number of reasons. My bias towards DAA is undeniable, and my experience is limited to September 15th until today. My ""honest assessment"" could never read this honest. 🙏  

🦍🤝🐧🤝🦍 https://t.co/4LemAV10EG","I am appreciative of  taking the time to put this thread together, for a number of reasons. My bias towards DAA is undeniable, and my experience is limited to September 15th until today. My ""honest assessment"" could never read this honest. 🙏    🦍🤝🐧🤝🦍 "
280,"I’ve been blessed to be able to spend the last year learning crypto, bitcoin, and NFTs. I’ve also been blessed to successfully dodge scams…until today. 👇👇👇","I’ve been blessed to be able to spend the last year learning crypto, bitcoin, and NFTs. I’ve also been blessed to successfully dodge scams…until today. 👇👇👇"
281,@jennifer_sutto I was never into NFT avatar until today. So iam an avatar newbie. What was utility for crypto punk?, I was never into NFT avatar until today. So iam an avatar newbie. What was utility for crypto punk?
282,"@Eljaboom @RealFlokiInu To all the #Floki Vikings in the world, this is the first time, an independent crypto currency has ever advertised in India. Yes, first ever. Until today, it was only Indian exchanges and that too, only Bitcoin. Just imagine, @RealFlokiInu is @SabreEthereum","  To all the Floki Vikings in the world, this is the first time, an independent crypto currency has ever advertised in India. Yes, first ever. Until today, it was only Indian exchanges and that too, only Bitcoin. Just imagine,  is "
283,@BAYC2745 never used Twitter Spaces until today. Had never bought an NFT until last week. Had never owned any Crypto until last month. Thanks for answering all the questions I had. This is a new and exciting world of opportunity! 🚀, never used Twitter Spaces until today. Had never bought an NFT until last week. Had never owned any Crypto until last month. Thanks for answering all the questions I had. This is a new and exciting world of opportunity! 🚀
284,"@eastbrin @lawmaster @ASvanevik @nansen_ai @stablekwon Can’t believe I haven’t watched this gem until today. 

I’m all caught up and holy shot how dare Do isn’t interested in US crypto regulation 😡 😡/s",     Can’t believe I haven’t watched this gem until today.   I’m all caught up and holy shot how dare Do isn’t interested in US crypto regulation 😡 😡/s
285,@RODRIGUEZCREED i did not know dsmp crypto fans existed until today and i feel my innards rotting https://t.co/65877H8Mzq, i did not know dsmp crypto fans existed until today and i feel my innards rotting 
286,"@BitMartExchange I have my starship crypto stuck more than two weeks, the price is melting and I'm not able to sell or trade, keep receiving message that my account is under review! Sent a lot of messages to support without any answer until today, that's incredbile."," I have my starship crypto stuck more than two weeks, the price is melting and I'm not able to sell or trade, keep receiving message that my account is under review! Sent a lot of messages to support without any answer until today, that's incredbile."
287,"I had on the down-low considered it until today. But because whoever is running the @TheRealStanLee  account had decided to use his legacy and name to sell NFTs, I will be swearing off the whole inkling of having NFTs or crypto for Southpaw-Comics for good. https://t.co/kRornirI1r","I had on the down-low considered it until today. But because whoever is running the   account had decided to use his legacy and name to sell NFTs, I will be swearing off the whole inkling of having NFTs or crypto for Southpaw-Comics for good. "
288,i had never encountered a crypto bro until today and i now realize i took that luck for granted. bro what are you even saying do you hear yourself,i had never encountered a crypto bro until today and i now realize i took that luck for granted. bro what are you even saying do you hear yourself
289,"Told you, to buy $COCOS and HOLD until today. #crypto #cmc #hold https://t.co/qHBZGsQVg1","Told you, to buy $COCOS and HOLD until today. crypto cmc hold "
290,"@KatyyyNg @UniverseTwenty I bought XRP when it crashes because of SEC lawsuit, all my XRP was in the exchange Coinberry i then moved to my Nano X, when they delist XRP. This was my only crypto i hold. I had never try sending it to exchange before until today i tested moving 1 XRP to Kraken - good","  I bought XRP when it crashes because of SEC lawsuit, all my XRP was in the exchange Coinberry i then moved to my Nano X, when they delist XRP. This was my only crypto i hold. I had never try sending it to exchange before until today i tested moving 1 XRP to Kraken - good"
291,"Well best part is I’m down to just checking crypto in macro senses and haven’t even opened my portfolio in a weeks until today. Felt/feels good.

Battle tested 💎🙌🏽 everything I can that hedges against rampant cronyism. 

Once we enter the next cycle, I’m in NFTs then. Full speed","Well best part is I’m down to just checking crypto in macro senses and haven’t even opened my portfolio in a weeks until today. Felt/feels good.  Battle tested 💎🙌🏽 everything I can that hedges against rampant cronyism.   Once we enter the next cycle, I’m in NFTs then. Full speed"
292,@Khalem16015547 @altonkeh @NeoonRunner @Ethio_crypto @shumi_legend @zoetworld @RigasDs @nobodymeisyou @Alexio1162 sorry if you are harassing khalem. I'm trying to publicize the project and try to get a gift. until today 9 utc,         sorry if you are harassing khalem. I'm trying to publicize the project and try to get a gift. until today 9 utc
293,"@Crypto_XRP_Hodl @Vagabondappio @CrazyrareJ @BradC_FF @SECGov @HMRCgovuk @HMRCcustomers @Moonchaser2020 i want to say yes, but i can't even begin to think how this is possible. they were doing so great until today","        i want to say yes, but i can't even begin to think how this is possible. they were doing so great until today"
294,"@ManchuBoo @Crypto_J001 agree. however, the big shills shall stop by the main shillers. investors are tired of big words but nothing to follow. eg. nothing followed the las vegas event, although it was said something huge (multiple listings) is following. until today, zero...
that kills all the patience","  agree. however, the big shills shall stop by the main shillers. investors are tired of big words but nothing to follow. eg. nothing followed the las vegas event, although it was said something huge (multiple listings) is following. until today, zero... that kills all the patience"
295,"The London Hard Fork Resulted in More Than 1.15 Million Ethereum Being Burned Until Today

#ethereum #crypto #cryptocurrency #bullish #bitcoin #gasfee
https://t.co/IBSlAq4ezy",The London Hard Fork Resulted in More Than 1.15 Million Ethereum Being Burned Until Today  ethereum crypto cryptocurrency bullish bitcoin gasfee 
296,"@APompliano Weird, it has been going down until today when people expected worse.  Crypto is not an inflation-hedge."," Weird, it has been going down until today when people expected worse.  Crypto is not an inflation-hedge."
297,@PatrickMcHenry I did not know your name until today. I love your attitude and approach to #Crypto. Can you be just as level headed in other areas???, I did not know your name until today. I love your attitude and approach to Crypto. Can you be just as level headed in other areas???
298,"I have no idea who this Craig Wright guy is, and being around crypto since 2017 have never once heard of him until today. 

My gut feeling is him winning a lawsuit that now claims he’s the sole founder and creator of BTC is the worst thing that could ever happen to BTC.

I’m out.","I have no idea who this Craig Wright guy is, and being around crypto since 2017 have never once heard of him until today.   My gut feeling is him winning a lawsuit that now claims he’s the sole founder and creator of BTC is the worst thing that could ever happen to BTC.  I’m out."
299,@shibburn @ShibaburnOut We need to know how much until today shib burn in crypto capital its the same,  We need to know how much until today shib burn in crypto capital its the same
300,@catapultbtc @crypto_bitlord7 They just care about their big investors. I had been an Open Sea user until today 🤷‍♂️,  They just care about their big investors. I had been an Open Sea user until today 🤷‍♂️
301,"Didn't really know anything about crypto currency until today. My take? It's just like NFT's and if you're stupid enough to invest in a nonsecure financial market, then you're an idiot and deserve to lose all your money.","Didn't really know anything about crypto currency until today. My take? It's just like NFT's and if you're stupid enough to invest in a nonsecure financial market, then you're an idiot and deserve to lose all your money."
302,"Here's a quick overview of #BTC that I've been following and live-streaming since August of this year. I tried to predict the bull-trap, but the #Bitcoin ETF helped pump the price of BTC up until November 14th, then November 15th until today the crypto market turned. #crypto https://t.co/FFyFLAkbSV","Here's a quick overview of BTC that I've been following and live-streaming since August of this year. I tried to predict the bull-trap, but the Bitcoin ETF helped pump the price of BTC up until November 14th, then November 15th until today the crypto market turned. crypto "
303,"@VilerKm @crypto_quokka Until today, I wasn't convinced miners joining the network en masse would be helpful to the price. But now, it makes sense that they would join, temporarily mine at a loss, and hodl until the price rises to a profitable point.","  Until today, I wasn't convinced miners joining the network en masse would be helpful to the price. But now, it makes sense that they would join, temporarily mine at a loss, and hodl until the price rises to a profitable point."
304,@shanselman @csnetprogrammer Congratulations on the top-secret crypto project! So secret that even you didn’t know about it until today 😂,  Congratulations on the top-secret crypto project! So secret that even you didn’t know about it until today 😂
305,"@Crypto_vault6 @heroparktoken I think the difficulties and challenges are more for you because you are doing something that no one has done before and you are improving it. Since they had the idea for Dexgem until today. What is Dexgem doing differently? How Dexgem will revolutionize the market?
@hg",  I think the difficulties and challenges are more for you because you are doing something that no one has done before and you are improving it. Since they had the idea for Dexgem until today. What is Dexgem doing differently? How Dexgem will revolutionize the market? 
306,"📢 #LoFiDeFi Weekly AMA Update

We will postpone our Live AMA until today at 9pm UTC to make sure our new Marketing Manager is available to give us an update on marketing plans!

Join the #AMA and subscribe to our channel!

https://t.co/yaMXaQSyOY

#Crypto #BSC #BSCGem #lofi #BNB https://t.co/vxLTFhnsY4",📢 LoFiDeFi Weekly AMA Update  We will postpone our Live AMA until today at 9pm UTC to make sure our new Marketing Manager is available to give us an update on marketing plans!  Join the AMA and subscribe to our channel!    Crypto BSC BSCGem lofi BNB 
307,@Crypto__emily From 27 Oct until today and we still waiting 😢, From 27 Oct until today and we still waiting 😢
308,"I explained the #SocialExperiment to another crypto person (he did not know me until today and based on his achievements, he is pretty smart) and he was pretty excited.

Cannot wait to share it with you all!

#polygon #fairlaunch #unique #SomethingNew #matic #polygongem","I explained the SocialExperiment to another crypto person (he did not know me until today and based on his achievements, he is pretty smart) and he was pretty excited.  Cannot wait to share it with you all!  polygon fairlaunch unique SomethingNew matic polygongem"
309,"Am I too late to stake for SUNDAE tokens? | SSFEED
Didn't know anything about it until today 
submitted by /u/SatoshiBizzle[visit reddit] [comments]
#ssfeed
https://t.co/IvbDZoQ0KL #cryptocurrency #crypto #altseason #defi #enrichedfeed #smartcontracts #furucombo #dex #cex",Am I too late to stake for SUNDAE tokens? | SSFEED Didn't know anything about it until today  submitted by /u/SatoshiBizzle[visit reddit] [comments] ssfeed  cryptocurrency crypto altseason defi enrichedfeed smartcontracts furucombo dex cex
310,"20 minutes until today’s execution of  the below strategy 👇🏼

Thank you @anchor_protocol for the opportunity 🙏

Are you diversified? 🧐

#Luna #Terra $Luna #DCA #Crypto https://t.co/i9pgTsYIoz",20 minutes until today’s execution of  the below strategy 👇🏼  Thank you  for the opportunity 🙏  Are you diversified? 🧐  Luna Terra $Luna DCA Crypto 
311,"@memoreno9 Yeah I just bought it as a joke but had a good return on it (until today lol). I was thinking about Cardano, I’ll check that one out. Where do you buy your crypto, coinbase?"," Yeah I just bought it as a joke but had a good return on it (until today lol). I was thinking about Cardano, I’ll check that one out. Where do you buy your crypto, coinbase?"
312,1/ I have heard friends and family outside the world of crypto say crypto will never work because people are “never buying coffee with Bitcoin.” I instinctively disagreed with this sentiment but never had the right data to rebuttal. Until today.,1/ I have heard friends and family outside the world of crypto say crypto will never work because people are “never buying coffee with Bitcoin.” I instinctively disagreed with this sentiment but never had the right data to rebuttal. Until today.
313,"#Dock has only been available for #crypto to crypto buyers, until today. 

Purchase DOCK tokens via bank transfers or card payments with fiat on/off ramp Transak. Try it out here: https://t.co/UFmRx5c4F6","Dock has only been available for crypto to crypto buyers, until today.   Purchase DOCK tokens via bank transfers or card payments with fiat on/off ramp Transak. Try it out here: "
314,@crypto @markets So @GaryGensler you already have @Uniswap spying on its users and that's not enough for you? I didn't even know they were spying until today. You and Uniswap suck.,  So  you already have  spying on its users and that's not enough for you? I didn't even know they were spying until today. You and Uniswap suck.
315,"Amazing seeing @thebitsian and Sid from @OnJunoHQ in SF today. One of our earliest customers; we never met face to face until today 🙌 

They have built a killer product to get your paycheck directly in crypto! Go download the app if you haven't 🚀 https://t.co/P6JArQ1sMC",Amazing seeing  and Sid from  in SF today. One of our earliest customers; we never met face to face until today 🙌   They have built a killer product to get your paycheck directly in crypto! Go download the app if you haven't 🚀 
316,@OL5ON @TronBattleAngel Irishgirl is one of the biggest women crypto warrior I know.  I didn’t realize she has a new twitter account until today and I followed immediately.  So glad to see her coming back and being active on Twitter again.,  Irishgirl is one of the biggest women crypto warrior I know.  I didn’t realize she has a new twitter account until today and I followed immediately.  So glad to see her coming back and being active on Twitter again.
