,Tweets,cleanedTweets
685,"I'm barely 4 months into crypto trading and so far it's been a merry ride until today. My profits are almost nullified. But I guess it's just a phase which will pass and market will bounce back soon...

$FET $MATIC $HOT $WIN $WRX $BTC $ETH $CHZ $MANA $SXP $XRP",I'm barely 4 months into crypto trading and so far it's been a merry ride until today. My profits are almost nullified. But I guess it's just a phase which will pass and market will bounce back soon...  $FET $MATIC $HOT $WIN $WRX $BTC $ETH $CHZ $MANA $SXP $XRP
686,"@flurbnb I got my FIRST crypto from free mining sites, takinh surveys etc few years ago... that is #btc and i regret that I didnt hodl it until today😭😂"," I got my FIRST crypto from free mining sites, takinh surveys etc few years ago... that is btc and i regret that I didnt hodl it until today😭😂"
687,"@CryptoCaptain_ I have a friend messaging me about safemoon. I haven’t heard of it until today, but would be curious to know more about it. Don’t want my normie friend getting burned and turn away from crypto"," I have a friend messaging me about safemoon. I haven’t heard of it until today, but would be curious to know more about it. Don’t want my normie friend getting burned and turn away from crypto"
688,Didn’t realize I was following so many #crypto influencers or #whales that were just straight up racist until today. This is why it’s important to keep your point of view to yourself sometimes. Wow. Unfollowed. These comments by some of all are truly sickening,Didn’t realize I was following so many crypto influencers or whales that were just straight up racist until today. This is why it’s important to keep your point of view to yourself sometimes. Wow. Unfollowed. These comments by some of all are truly sickening
689,until today i thought crypto-fascism just meant fascists who use bitcoin,until today i thought crypto-fascism just meant fascists who use bitcoin
690,@TheFrankyyy You actually call yourself crypto Frank and didn’t know how and why Doge moves until today? 🤦‍♂️, You actually call yourself crypto Frank and didn’t know how and why Doge moves until today? 🤦‍♂️
691,I feel completely different on the ‘4 year crypto bull/bear cycles’ as we have known until today.  We might see a super cycle this time. The capital from the big investors and hedge funds is here to stay. $BTC $Kai $Vet $Rsr $Zil https://t.co/zDhEgJJYKm,I feel completely different on the ‘4 year crypto bull/bear cycles’ as we have known until today.  We might see a super cycle this time. The capital from the big investors and hedge funds is here to stay. $BTC $Kai $Vet $Rsr $Zil 
692,@crypto_bitlord7 I am totally into #MRX #metrix coin. Great use cases even greater team behind it. It has been my top portfolio performer until today when #shiba took a parabolic run!, I am totally into MRX metrix coin. Great use cases even greater team behind it. It has been my top portfolio performer until today when shiba took a parabolic run!
693,I forgot I had crypto until today. Nice.,I forgot I had crypto until today. Nice.
694,"LOL. I bought $doge in Jan 2014 on https://t.co/9ozX1s2pKO I never touched it and completely forgot until today.

It’s a defunct crypto exchange. Bye bye  lots of money.",LOL. I bought $doge in Jan 2014 on  I never touched it and completely forgot until today.  It’s a defunct crypto exchange. Bye bye  lots of money.
695,"@BitTorrent BtcTurk CEO Özgür Güneri: Our users will be able to deposit and withdraw Turkish Lira 24/7 via our bank accounts from now on, as it has been until today. #crypto"," BtcTurk CEO Özgür Güneri: Our users will be able to deposit and withdraw Turkish Lira 24/7 via our bank accounts from now on, as it has been until today. crypto"
696,"@maxkeiser BtcTurk CEO Özgür Güneri: Our users will be able to deposit and withdraw Turkish Lira 24/7 via our bank accounts from now on, as it has been until today. #crypto"," BtcTurk CEO Özgür Güneri: Our users will be able to deposit and withdraw Turkish Lira 24/7 via our bank accounts from now on, as it has been until today. crypto"
697,"@BTC_Archive BtcTurk CEO Özgür Güneri: Our users will be able to deposit and withdraw Turkish Lira 24/7 via our bank accounts from now on, as it has been until today. #crypto"," BtcTurk CEO Özgür Güneri: Our users will be able to deposit and withdraw Turkish Lira 24/7 via our bank accounts from now on, as it has been until today. crypto"
698,"I have to admit I have never made over $2K in passive income in 8 hours until today. Investing in crypto has done good for me. No, I’m not selling. If it dips it dips, which means I’ll buy more until it climbs again, as it will again. #doge #DogecoinToTheMoon 🚀","I have to admit I have never made over $2K in passive income in 8 hours until today. Investing in crypto has done good for me. No, I’m not selling. If it dips it dips, which means I’ll buy more until it climbs again, as it will again. doge DogecoinToTheMoon 🚀"
699,"Good morning.
Does anyone have a figure for the biggest $ longs liquidations in one single day (until today) for #crypto?
#Bitcoin #Ethereum #alts",Good morning. Does anyone have a figure for the biggest $ longs liquidations in one single day (until today) for crypto? Bitcoin Ethereum alts
700,"Actually this is an old acquisition which I didn’t know until today. Crypto is a massive market and if the company is seriously working on this, we may see a huge potential here in the future maybe more important than the movie and streaming business...","Actually this is an old acquisition which I didn’t know until today. Crypto is a massive market and if the company is seriously working on this, we may see a huge potential here in the future maybe more important than the movie and streaming business..."
701,"It’s all fun and smiles when writing and reposting about this incredible project, Elrond… But the community is also praised for being one of the strongest in the crypto World. How many friends did you referred until today? #elrondnetwork #beniaminmincu $MEX $EGLD","It’s all fun and smiles when writing and reposting about this incredible project, Elrond… But the community is also praised for being one of the strongest in the crypto World. How many friends did you referred until today? elrondnetwork beniaminmincu $MEX $EGLD"
702,$ostk the only actual true crypto exchange proxy to $coin IPO today. Hope it didnt take you until today to find that out,$ostk the only actual true crypto exchange proxy to $coin IPO today. Hope it didnt take you until today to find that out
703,You’re waiting until today to invest in Coinbase? I’ve been a shadow invested leveraged in that company for a decade? #rich #money $coin $btc #crypto,You’re waiting until today to invest in Coinbase? I’ve been a shadow invested leveraged in that company for a decade? rich money $coin $btc crypto
704,I just found a convo from 2018 with @ReggieRegSW putting me onto Coinbase lol I bought some crypto back then and ain’t look at it again until today lol nice surprise,I just found a convo from 2018 with  putting me onto Coinbase lol I bought some crypto back then and ain’t look at it again until today lol nice surprise
705,"LIVE: Until today, #bitcoin was a better investment for @DCGco than @Coinbase or other companies. 

“Of course we will take some money back into the table...but that money gets plowed back into the crypto ecosystem,” says @BarrySilbert.

https://t.co/QwMVGlutQG","LIVE: Until today, bitcoin was a better investment for  than  or other companies.   “Of course we will take some money back into the table...but that money gets plowed back into the crypto ecosystem,” says .  "
706,"@WabisuNFTLover Well I was a stock investor / crypto investor before I knew about NFT, but the stock market is a mess during Feb -&gt; March and crypto was going sideways until today. Altcoin is doing very well tho"," Well I was a stock investor / crypto investor before I knew about NFT, but the stock market is a mess during Feb -&gt; March and crypto was going sideways until today. Altcoin is doing very well tho"
707,Which #crypto is your biggest gainer until today? 👀,Which crypto is your biggest gainer until today? 👀
708,@moviefreakgirl I actually bought Doge today before it shot up.  Ever bought crypto until today 😂 good day today, I actually bought Doge today before it shot up.  Ever bought crypto until today 😂 good day today
709,"Woahhh, I had forgotten about my #DOGE🚀 crypto investment... until today. WTF has happened? Huge jump!","Woahhh, I had forgotten about my DOGE🚀 crypto investment... until today. WTF has happened? Huge jump!"
710,"I’ve only ever bought and held crypto. Until today. I made my first purchase with Crypto. If you chose to use a credit card, the company called it “Muggle Pay”","I’ve only ever bought and held crypto. Until today. I made my first purchase with Crypto. If you chose to use a credit card, the company called it “Muggle Pay”"
711,@crypto_pinapple @cz_binance @binance Tell me you are still holdimg until today !,   Tell me you are still holdimg until today !
712,My cousin started investing in crypto September last year. Until today he only holds one single bag. Guess which one?? $Link #Chainlink,My cousin started investing in crypto September last year. Until today he only holds one single bag. Guess which one?? $Link Chainlink
713,"2012 #crypto market was cool. 

2017 suddenly fiat came from banks, hyperinflation things? 
people startet calling pioneers shitcoins &amp; sold for only #margin #gambling until today 
the train lost its way. Again big central hodlers, no privacy.
Market was good before they came.","2012 crypto market was cool.   2017 suddenly fiat came from banks, hyperinflation things?  people startet calling pioneers shitcoins &amp; sold for only margin gambling until today  the train lost its way. Again big central hodlers, no privacy. Market was good before they came."
714,"From April 1st, until today, price is dominated by a bearish candle. Volume prices are also lower than at the end of March. Today the price has decreased after touching 70.0 and is heading downwards 60.0 on the RSI. What next? Visit https://t.co/elIq3U1zIX. #trade #crypto https://t.co/OLknhMB8Qn","From April 1st, until today, price is dominated by a bearish candle. Volume prices are also lower than at the end of March. Today the price has decreased after touching 70.0 and is heading downwards 60.0 on the RSI. What next? Visit  trade crypto "
715,"How to Trade Crypto

Years ago when #BTC dive to 4000, @SpyfratsCall started tracking it consistenly until today at 58000.

When #XRP nose dive months ago, he did it again (ala Britney Spears). Bought at low then chart consistently. Now it's flying. 

 It's just another trade.","How to Trade Crypto  Years ago when BTC dive to 4000,  started tracking it consistenly until today at 58000.  When XRP nose dive months ago, he did it again (ala Britney Spears). Bought at low then chart consistently. Now it's flying.    It's just another trade."
716,"#DYP campaign until today only guys!!! join the Activity 3 to win $DYP 🚀
#DeFi #kucoin #crypto https://t.co/049WHFJXYM",DYP campaign until today only guys!!! join the Activity 3 to win $DYP 🚀 DeFi kucoin crypto 
717,"@awilkinson You forgot about darknet. Crypto's only real usage until today. 

No one use crypto with current transaction fees and speed. Seems like everyone just depositing to crypto exchanges (gambling).", You forgot about darknet. Crypto's only real usage until today.   No one use crypto with current transaction fees and speed. Seems like everyone just depositing to crypto exchanges (gambling).
718,"Never heard of Epicenter Podcast or Julien until today...but have been following @RektHQ since launch. Highly recommend this interview for some unique, deep, at times dark, &amp; realistic views on crypto! https://t.co/VeyDCItJk5","Never heard of Epicenter Podcast or Julien until today...but have been following  since launch. Highly recommend this interview for some unique, deep, at times dark, &amp; realistic views on crypto! "
719,"I’m immersed into crypto since 2012/2013 and It was one the best and professional launches I have participated until today. Documentation, communication, tools, community support, etc. Congrats to @cyberfi_tech and @ArtxTrading. https://t.co/0AJq81SOKN","I’m immersed into crypto since 2012/2013 and It was one the best and professional launches I have participated until today. Documentation, communication, tools, community support, etc. Congrats to  and . "
720,@cryptocom @wanderingstan So I created my account but despite multiple attempts was unable to verify until today? Please help,  So I created my account but despite multiple attempts was unable to verify until today? Please help
721,"The beginning of the inception of the ""MARRANO JEWS"" a form of Crypto Judaism which is present until today.
For those whom don't understand Spanish, ""MARRANO"" translated into english means ""PORK"" or ""PIG"". https://t.co/tTCWFeZDUE","The beginning of the inception of the ""MARRANO JEWS"" a form of Crypto Judaism which is present until today. For those whom don't understand Spanish, ""MARRANO"" translated into english means ""PORK"" or ""PIG"". "
722,@SidWalia @cryptocom 17 days until today,  17 days until today
723,"@cryptocom @Visa The support team claims to have received the transfer on May 15, 2021, but the money has not entered my fiat wallet until today.","  The support team claims to have received the transfer on May 15, 2021, but the money has not entered my fiat wallet until today."
724,"Was playing crypto in ranked up until today, decided to go back to revenant, problem is I am not used to using my tactical that often again so I never end up using it, fun","Was playing crypto in ranked up until today, decided to go back to revenant, problem is I am not used to using my tactical that often again so I never end up using it, fun"
725,I remember when some #crypto  communities trying to make joke about #Cardano last year and some people saying a lot of lies about this project and then #Cardano rises since last March until today more than 3600% in value. Now i see the same pattern,I remember when some crypto  communities trying to make joke about Cardano last year and some people saying a lot of lies about this project and then Cardano rises since last March until today more than 3600% in value. Now i see the same pattern
726,"@AdamSinger @BullandBaird I would think any purchase with crypto now would incur a tax liability. As an interesting aside, May 22, 2010 is now known as Bitcoin  pizza 🍕 day because that is when 2 pizzas were purchased using 10000 Bitcoin. Imagine if the delivery person had kept their tip until today!","  I would think any purchase with crypto now would incur a tax liability. As an interesting aside, May 22, 2010 is now known as Bitcoin  pizza 🍕 day because that is when 2 pizzas were purchased using 10000 Bitcoin. Imagine if the delivery person had kept their tip until today!"
727,"@MitchTypoCr @TeddyCleps Revolut -&gt; SEPA -&gt; Binance worked until today , generic error shown but they started blocking xfers to crypto","  Revolut -&gt; SEPA -&gt; Binance worked until today , generic error shown but they started blocking xfers to crypto"
728,@Bulldiscoveryy Crypto heads be like 👆. I remember that day when this guy show up and offered me 300 or more Bitcoin to buy some item I had on my ecom ahop about 10 years ago and until today I know Bitcoin is worth a shit ton of money but I still haven't understand it's technical side., Crypto heads be like 👆. I remember that day when this guy show up and offered me 300 or more Bitcoin to buy some item I had on my ecom ahop about 10 years ago and until today I know Bitcoin is worth a shit ton of money but I still haven't understand it's technical side.
729,"@heyanniebrown @packyM @opensea But as I said, I'm sceptical. I've never owned any crypto or really paid much attention to that world until today, but thought it would be interesting to try it out.","   But as I said, I'm sceptical. I've never owned any crypto or really paid much attention to that world until today, but thought it would be interesting to try it out."
730,"@CountOfBitcoin @J0E007 This is the one million dollar question. IMO Bitcoin as a hedge against inflation is, until today, a crypto enthusiats's wet dream ... but idk tho","  This is the one million dollar question. IMO Bitcoin as a hedge against inflation is, until today, a crypto enthusiats's wet dream ... but idk tho"
731,"@Macropsychology you're right that it seems scummy, but how merchants will handle crypto transactions that are refundable is a huge question mark that I haven't heard discussed until today"," you're right that it seems scummy, but how merchants will handle crypto transactions that are refundable is a huge question mark that I haven't heard discussed until today"
732,"@sexyrida86 @cryptocom That’s because until today they have been a er20 token. Their main net launches today, the old 200 cro gas fees will be a thing of the past . https://t.co/Ruq7tCeacT","  That’s because until today they have been a er20 token. Their main net launches today, the old 200 cro gas fees will be a thing of the past . "
733,i have paid zero attention to crypto at all and up until today I honestly thought ‘winklevoss twins’ was a chapo bit like ‘lucinda grunch’,i have paid zero attention to crypto at all and up until today I honestly thought ‘winklevoss twins’ was a chapo bit like ‘lucinda grunch’
734,"@Crypto_Fridays I Will pick and choose $PLOT. This is one of my best coin I hold until today. 

All powered by their native ANRX Ethereum arcade coin. The first brand new industry fueled by Defi, eSports and web 3.0 NFTs with groundbreaking potential called m$ports"," I Will pick and choose $PLOT. This is one of my best coin I hold until today.   All powered by their native ANRX Ethereum arcade coin. The first brand new industry fueled by Defi, eSports and web 3.0 NFTs with groundbreaking potential called m$ports"
735,"@Crypto_Fridays I Will pick and choose $PLOT. This is one of my best coin I hold until today. 

All powered by their native ANRX Ethereum arcade coin. The first brand new industry fueled by Defi, eSports and web 3.0 NFTs with groundbreaking potential called m$ports"," I Will pick and choose $PLOT. This is one of my best coin I hold until today.   All powered by their native ANRX Ethereum arcade coin. The first brand new industry fueled by Defi, eSports and web 3.0 NFTs with groundbreaking potential called m$ports"
736,"@Crypto_Fridays I Will pick and choose $PLOT. This is one of my best coin I hold until today. 

All powered by their native ANRX Ethereum arcade coin. The first brand new industry fueled by Defi, eSports and web 3.0 NFTs with groundbreaking potential called m$ports"," I Will pick and choose $PLOT. This is one of my best coin I hold until today.   All powered by their native ANRX Ethereum arcade coin. The first brand new industry fueled by Defi, eSports and web 3.0 NFTs with groundbreaking potential called m$ports"
737,"@Crypto_Fridays I Will pick and choose $PLOT. This is one of my best coin I hold until today. 

All powered by their native ANRX Ethereum arcade coin. The first brand new industry fueled by Defi, eSports and web 3.0 NFTs with groundbreaking potential called m$ports"," I Will pick and choose $PLOT. This is one of my best coin I hold until today.   All powered by their native ANRX Ethereum arcade coin. The first brand new industry fueled by Defi, eSports and web 3.0 NFTs with groundbreaking potential called m$ports"
738,@crypto_pr1ncess LOL same I restarted playing a months ago but again I havent played for 3 weeks until today 😫😫 need more time, LOL same I restarted playing a months ago but again I havent played for 3 weeks until today 😫😫 need more time
739,"25min until today's #BTC  candle close... 🕑

Our latest #Bitcoin + #Ethereum Technical Analysis video 🤓👇

🎦 https://t.co/mPh99bDol8 🎦

#ETH $BTC $ETH #Crypto #Trading https://t.co/4OXoOgBFGX",25min until today's BTC  candle close... 🕑  Our latest Bitcoin + Ethereum Technical Analysis video 🤓👇  🎦  🎦  ETH $BTC $ETH Crypto Trading 
740,"Had no idea you could actually replace the recipient address with a personalized link tied to your account until today. 
It's actually pretty cool, @cryptocom https://t.co/vnVhyPBgBx","Had no idea you could actually replace the recipient address with a personalized link tied to your account until today.  It's actually pretty cool,  "
741,@rservaas @antonytrades14 Oh ok. I invest in Blockport in 2018 and forgot about it until today. An i saw some decent price increase and movement recently. I can't see there crypto app though.,  Oh ok. I invest in Blockport in 2018 and forgot about it until today. An i saw some decent price increase and movement recently. I can't see there crypto app though.
742,"@Crypto_Bard @BryanSpark2 @RangersFC The old firm was never been interested in irish catholic demonisation and sectariamism.and up until today, it was the only  example of racism i experienced when Celtic played The https://t.co/fuTebTNH1h is all Racism and has never been anything but!!","   The old firm was never been interested in irish catholic demonisation and sectariamism.and up until today, it was the only  example of racism i experienced when Celtic played The  is all Racism and has never been anything but!!"
743,"This...this right here is why you invest. From January until today (March 19th) I have invested $700 into cryptocurrency. In 2 months I have made over $2,300. Invest and HOLD!  #flux #Bitcoin #investing #cryptocurrency #Crypto #Ethereum @RunOnFlux @Zel_Core https://t.co/8ClGMTC5UX","This...this right here is why you invest. From January until today (March 19th) I have invested $700 into cryptocurrency. In 2 months I have made over $2,300. Invest and HOLD!  flux Bitcoin investing cryptocurrency Crypto Ethereum   "
744,@maxkeiser @PontificAsian @Crypto_Standard @IOHK_Charles @gokhshteinmedia So Cardano IS quite the competition I guess? BTW. Long time follower...until today. Good luck and good bye,     So Cardano IS quite the competition I guess? BTW. Long time follower...until today. Good luck and good bye
745,$BTC $ALTS i think if u copy traded most of my ideas from november with only a couple of hundred bucks and held until today you might be kind of rich right now lol #Crypto #Bitcoin #Altcoins,$BTC $ALTS i think if u copy traded most of my ideas from november with only a couple of hundred bucks and held until today you might be kind of rich right now lol Crypto Bitcoin Altcoins
746,"@SquawkCNBC @robtfrank Not what you and @beckyquick said on air the other day. And for crypto users, it’s no crap. You sell one crypto to buy another, it’s a tax event. We get it. Apparently you, until today, not so much.","  Not what you and  said on air the other day. And for crypto users, it’s no crap. You sell one crypto to buy another, it’s a tax event. We get it. Apparently you, until today, not so much."
747,"Ladies &amp; gents, get ready for the crypto market to absolutely pop! Stimulus this/that is all I’ve heard about, but it was theory to me...until today. One of my son’s teachers approached me today and said, “I’m getting $8k+ in stimulus, don’t need it, what cryptos do I invest in?”","Ladies &amp; gents, get ready for the crypto market to absolutely pop! Stimulus this/that is all I’ve heard about, but it was theory to me...until today. One of my son’s teachers approached me today and said, “I’m getting $8k+ in stimulus, don’t need it, what cryptos do I invest in?”"
748,"Never knew a crypto transaction can take 3 months to reflect until today. 
Everything about this Feminist co is sham from the start, including their plagiarized logo!","Never knew a crypto transaction can take 3 months to reflect until today.  Everything about this Feminist co is sham from the start, including their plagiarized logo!"
749,@Crypto_Chadz @sassal0x do you hold until today though?,  do you hold until today though?
750,"Spoke to an old friend about crypto. I've worked with him on and off since 2005 but never brought it up until today. Turns out he only just bit the bullet, but also casually mentioned that his friends started Holochain. ""Yeah, don't know how well they did!""","Spoke to an old friend about crypto. I've worked with him on and off since 2005 but never brought it up until today. Turns out he only just bit the bullet, but also casually mentioned that his friends started Holochain. ""Yeah, don't know how well they did!"""
751,"@MoonManT @digitalassetbuy @FlareNetworks First time using Uniswap and i haven't bought ETH so far, until today. $10 for a transaction fee to be hit with another $50 gas fee? What is this shit? Just to convert some crypto. Dude, fuck ETH.","   First time using Uniswap and i haven't bought ETH so far, until today. $10 for a transaction fee to be hit with another $50 gas fee? What is this shit? Just to convert some crypto. Dude, fuck ETH."
752,"It never even hit me this is the case until today. Which is good, now I am aware and can address it. I either need to hold my crypto positions as confidently as my stocks or just trade stocks even though crypto is more +EV (Most likely)","It never even hit me this is the case until today. Which is good, now I am aware and can address it. I either need to hold my crypto positions as confidently as my stocks or just trade stocks even though crypto is more +EV (Most likely)"
